{
  "$schema": "./question-bank.schema.json",
  "courseSlug": "volunteers-onboarding",
  "version": 1,
  "settings": {
    "passMark": 80,
    "questionsPerAttempt": 10
  },
  "sections": [
    {
      "topic": "about-kc",
      "title": "About KC"
    },
    {
      "topic": "our-values",
      "title": "KC's Core Values"
    },
    {
      "topic": "seasons-of-kc",
      "title": "Seasons / History of KC"
    },
    {
      "topic": "church-family",
      "title": "Jubilee Church MCR & Leadership"
    },
    {
      "topic": "how-were-organised",
      "title": "KC Structure (Volunteer Hierarchy)"
    },
    {
      "topic": "what-we-believe",
      "title": "What We Believe (Statement of Faith)"
    },
    {
      "topic": "what-we-offer",
      "title": "What We Offer"
    },
    {
      "topic": "recap",
      "title": "Closing / General Recap"
    }
  ],
  "questions": [
    {
      "id": "Q01",
      "topic": "about-kc",
      "prompt": "What does \"KC\" stand for?",
      "options": [
        {
          "id": "a",
          "text": "Kids' Class"
        },
        {
          "id": "b",
          "text": "Kingdom Community"
        },
        {
          "id": "c",
          "text": "Kingdom Church"
        },
        {
          "id": "d",
          "text": "Kingdom Culture"
        }
      ],
      "correctOptionId": "d",
      "explanation": "",
      "required": false,
      "active": true
    },
    {
      "id": "Q02",
      "topic": "about-kc",
      "group": "rccg-family",
      "prompt": "KC is the young adult expression of which church?",
      "options": [
        {
          "id": "a",
          "text": "Manchester Cathedral"
        },
        {
          "id": "b",
          "text": "Jubilee Church Manchester (RCCG)"
        },
        {
          "id": "c",
          "text": "Hillsong Manchester"
        },
        {
          "id": "d",
          "text": "Kingdom Life Chapel"
        }
      ],
      "correctOptionId": "b",
      "explanation": "",
      "required": false,
      "active": true
    },
    {
      "id": "Q03",
      "topic": "about-kc",
      "group": "kc-mission",
      "prompt": "Which of the following is KC's stated mission?",
      "options": [
        {
          "id": "a",
          "text": "Hosting weekly concerts"
        },
        {
          "id": "b",
          "text": "Training future pastors only"
        },
        {
          "id": "c",
          "text": "Raising kingdom-minded disciples"
        },
        {
          "id": "d",
          "text": "Growing the largest youth group in the UK"
        }
      ],
      "correctOptionId": "c",
      "explanation": "",
      "required": false,
      "active": true
    },
    {
      "id": "Q04",
      "topic": "about-kc",
      "group": "kc-founded",
      "prompt": "In what year was KC founded?",
      "options": [
        {
          "id": "a",
          "text": "2012"
        },
        {
          "id": "b",
          "text": "2015"
        },
        {
          "id": "c",
          "text": "2018"
        },
        {
          "id": "d",
          "text": "2019"
        }
      ],
      "correctOptionId": "b",
      "explanation": "",
      "required": false,
      "active": true
    },
    {
      "id": "Q05",
      "topic": "about-kc",
      "group": "kc-beginnings",
      "prompt": "How did KC begin?",
      "options": [
        {
          "id": "a",
          "text": "As a youth choir"
        },
        {
          "id": "b",
          "text": "As a Bible college"
        },
        {
          "id": "c",
          "text": "As a registered charity"
        },
        {
          "id": "d",
          "text": "As a small fellowship"
        }
      ],
      "correctOptionId": "d",
      "explanation": "",
      "required": false,
      "active": true
    },
    {
      "id": "Q06",
      "topic": "about-kc",
      "group": "kc-beginnings",
      "prompt": "Which statement best reflects KC's early history?",
      "options": [
        {
          "id": "a",
          "text": "It began as a separate denomination"
        },
        {
          "id": "b",
          "text": "It was founded by RCCG headquarters in Nigeria"
        },
        {
          "id": "c",
          "text": "It began as a small fellowship and grew into a group of hundreds"
        },
        {
          "id": "d",
          "text": "It launched with over 500 members"
        }
      ],
      "correctOptionId": "c",
      "explanation": "",
      "required": false,
      "active": true
    },
    {
      "id": "Q07",
      "topic": "about-kc",
      "group": "spiritual-costco",
      "prompt": "KC describes its culture as a \"Spiritual ______.\"",
      "options": [
        {
          "id": "a",
          "text": "Buffet"
        },
        {
          "id": "b",
          "text": "Costco"
        },
        {
          "id": "c",
          "text": "Marketplace"
        },
        {
          "id": "d",
          "text": "Garden"
        }
      ],
      "correctOptionId": "b",
      "explanation": "",
      "required": false,
      "active": true
    },
    {
      "id": "Q08",
      "topic": "about-kc",
      "group": "spiritual-costco",
      "prompt": "What does the \"Spiritual Costco\" description mean about KC's culture?",
      "options": [
        {
          "id": "a",
          "text": "Variety is the norm, and the norm is variety"
        },
        {
          "id": "b",
          "text": "Only large events are held"
        },
        {
          "id": "c",
          "text": "Everyone must follow one fixed style"
        },
        {
          "id": "d",
          "text": "Membership requires a subscription"
        }
      ],
      "correctOptionId": "a",
      "explanation": "",
      "required": false,
      "active": true
    },
    {
      "id": "Q09",
      "topic": "about-kc",
      "group": "spiritual-costco",
      "prompt": "Which of the following best describes KC's culture?",
      "options": [
        {
          "id": "a",
          "text": "Highly uniform and traditional"
        },
        {
          "id": "b",
          "text": "A \"Spiritual Costco\" where variety is the norm"
        },
        {
          "id": "c",
          "text": "Focused only on one style of worship"
        },
        {
          "id": "d",
          "text": "Closed to new ideas"
        }
      ],
      "correctOptionId": "b",
      "explanation": "",
      "required": false,
      "active": true
    },
    {
      "id": "Q10",
      "topic": "about-kc",
      "group": "kc-mission",
      "prompt": "KC exists to raise ______-minded disciples.",
      "options": [
        {
          "id": "a",
          "text": "community"
        },
        {
          "id": "b",
          "text": "career"
        },
        {
          "id": "c",
          "text": "kingdom"
        },
        {
          "id": "d",
          "text": "campus"
        }
      ],
      "correctOptionId": "c",
      "explanation": "",
      "required": false,
      "active": true
    },
    {
      "id": "Q11",
      "topic": "our-values",
      "group": "values-list",
      "prompt": "What are KC's three core values?",
      "options": [
        {
          "id": "a",
          "text": "Kingdom, Excellence, Discipleship"
        },
        {
          "id": "b",
          "text": "Kingdom, Community, Growth"
        },
        {
          "id": "c",
          "text": "Faith, Hope, Love"
        },
        {
          "id": "d",
          "text": "Worship, Prayer, Service"
        }
      ],
      "correctOptionId": "a",
      "explanation": "",
      "required": false,
      "active": true
    },
    {
      "id": "Q12",
      "topic": "our-values",
      "group": "value-verses",
      "prompt": "Which Bible verse is associated with the value \"Kingdom\"?",
      "options": [
        {
          "id": "a",
          "text": "Matthew 6:33"
        },
        {
          "id": "b",
          "text": "John 3:16"
        },
        {
          "id": "c",
          "text": "Matthew 28:19-20"
        },
        {
          "id": "d",
          "text": "Daniel 5:12"
        }
      ],
      "correctOptionId": "a",
      "explanation": "",
      "required": false,
      "active": true
    },
    {
      "id": "Q13",
      "topic": "our-values",
      "group": "value-verses",
      "prompt": "Which Bible verse is associated with the value \"Excellence\"?",
      "options": [
        {
          "id": "a",
          "text": "Matthew 6:33"
        },
        {
          "id": "b",
          "text": "Matthew 28:19-20"
        },
        {
          "id": "c",
          "text": "Daniel 5:12"
        },
        {
          "id": "d",
          "text": "Psalm 23:1"
        }
      ],
      "correctOptionId": "c",
      "explanation": "",
      "required": false,
      "active": true
    },
    {
      "id": "Q14",
      "topic": "our-values",
      "group": "value-verses",
      "prompt": "Which Bible verse is associated with the value \"Discipleship\"?",
      "options": [
        {
          "id": "a",
          "text": "Matthew 6:33"
        },
        {
          "id": "b",
          "text": "Daniel 5:12"
        },
        {
          "id": "c",
          "text": "Romans 12:1"
        },
        {
          "id": "d",
          "text": "Matthew 28:19-20"
        }
      ],
      "correctOptionId": "d",
      "explanation": "",
      "required": false,
      "active": true
    },
    {
      "id": "Q15",
      "topic": "our-values",
      "group": "value-verses",
      "prompt": "Which value is paired with Matthew 28:19-20?",
      "options": [
        {
          "id": "a",
          "text": "Kingdom"
        },
        {
          "id": "b",
          "text": "Excellence"
        },
        {
          "id": "c",
          "text": "Discipleship"
        },
        {
          "id": "d",
          "text": "Community"
        }
      ],
      "correctOptionId": "c",